{
  "checkedAt": "2026-09-30T06:55:55.155Z",
  "counts": {
    "urls": 980,
    "references": 1383,
    "ok": 960,
    "broken": 20,
    "brokenUnexpected": 0
  },
  "ok": [
    "http://ocaml-book.com/",
    "https://advances.realtimerendering.com/",
    "https://archim.org.uk/resources/",
    "https://archim.soc.srcf.net/wp-content/uploads/2026/01/Archimedeans-Freshers-guide.pdf",
    "https://at2027.user.srcf.net/IA.html",
    "https://at2027.user.srcf.net/IB.html",
    "https://books.openbookpublishers.com/10.11647/obp.0181.pdf",
    "https://cs3110.github.io/textbook/chapters/basics/exercises.html",
    "https://cs3110.github.io/textbook/chapters/basics/intro.html",
    "https://cs3110.github.io/textbook/chapters/conc/exercises.html",
    "https://cs3110.github.io/textbook/chapters/conc/intro.html",
    "https://cs3110.github.io/textbook/chapters/correctness/exercises.html",
    "https://cs3110.github.io/textbook/chapters/correctness/intro.html",
    "https://cs3110.github.io/textbook/chapters/data/exercises.html",
    "https://cs3110.github.io/textbook/chapters/data/intro.html",
    "https://cs3110.github.io/textbook/chapters/ds/exercises.html",
    "https://cs3110.github.io/textbook/chapters/ds/intro.html",
    "https://cs3110.github.io/textbook/chapters/hop/exercises.html",
    "https://cs3110.github.io/textbook/chapters/hop/intro.html",
    "https://cs3110.github.io/textbook/chapters/interp/exercises.html",
    "https://cs3110.github.io/textbook/chapters/interp/intro.html",
    "https://cs3110.github.io/textbook/chapters/intro/intro.html",
    "https://cs3110.github.io/textbook/chapters/modules/exercises.html",
    "https://cs3110.github.io/textbook/chapters/modules/intro.html",
    "https://cs3110.github.io/textbook/chapters/mut/exercises.html",
    "https://cs3110.github.io/textbook/chapters/mut/intro.html",
    "https://dec41.user.srcf.net/notes/IA_L/analysis_i.pdf",
    "https://dec41.user.srcf.net/notes/IA_L/dynamics_and_relativity.pdf",
    "https://dec41.user.srcf.net/notes/IA_L/probability.pdf",
    "https://dec41.user.srcf.net/notes/IA_L/vector_calculus.pdf",
    "https://dec41.user.srcf.net/notes/IA_M/differential_equations.pdf",
    "https://dec41.user.srcf.net/notes/IA_M/groups.pdf",
    "https://dec41.user.srcf.net/notes/IA_M/numbers_and_sets.pdf",
    "https://dec41.user.srcf.net/notes/IA_M/vectors_and_matrices.pdf",
    "https://dec41.user.srcf.net/notes/IB_E/optimisation.pdf",
    "https://dec41.user.srcf.net/notes/IB_E/variational_principles.pdf",
    "https://dec41.user.srcf.net/notes/IB_L/numerical_analysis.pdf",
    "https://dec41.user.srcf.net/notes/IB_L/statistics.pdf",
    "https://dec41.user.srcf.net/notes/IB_M/linear_algebra.pdf",
    "https://dec41.user.srcf.net/notes/IB_M/markov_chains.pdf",
    "https://dev.realworldocaml.org/",
    "https://education.siggraph.org/cgsource",
    "https://esat-tmua.ac.uk/about-the-tests/tmua-test/",
    "https://esat-tmua.ac.uk/prepare/",
    "https://hub.cl.cam.ac.uk/",
    "https://isaacphysics.org/pages/nstia_workbook",
    "https://ocaml.org/docs/install.html",
    "https://richardhammack.github.io/BookOfProof/",
    "https://richardhammack.github.io/BookOfProof/Main.pdf#page=125",
    "https://richardhammack.github.io/BookOfProof/Main.pdf#page=140",
    "https://richardhammack.github.io/BookOfProof/Main.pdf#page=149",
    "https://richardhammack.github.io/BookOfProof/Main.pdf#page=15",
    "https://richardhammack.github.io/BookOfProof/Main.pdf#page=159",
    "https://richardhammack.github.io/BookOfProof/Main.pdf#page=169",
    "https://richardhammack.github.io/BookOfProof/Main.pdf#page=184",
    "https://richardhammack.github.io/BookOfProof/Main.pdf#page=192",
    "https://richardhammack.github.io/BookOfProof/Main.pdf#page=213",
    "https://richardhammack.github.io/BookOfProof/Main.pdf#page=235",
    "https://richardhammack.github.io/BookOfProof/Main.pdf#page=281",
    "https://richardhammack.github.io/BookOfProof/Main.pdf#page=46",
    "https://richardhammack.github.io/BookOfProof/Main.pdf#page=77",
    "https://step.maths.org/",
    "https://step.maths.org/assignments/mixed-mechanics-step-1-questions",
    "https://step.maths.org/assignments/mixed-pure-step-1-questions",
    "https://step.maths.org/assignments/mixed-statistics-step-1-questions",
    "https://step.maths.org/assignments/step-2-calculus",
    "https://step.maths.org/assignments/step-2-complex-numbers",
    "https://step.maths.org/assignments/step-2-curve-sketching",
    "https://step.maths.org/assignments/step-2-equations-and-inequalities",
    "https://step.maths.org/assignments/step-2-matrices",
    "https://step.maths.org/assignments/step-2-mechanics",
    "https://step.maths.org/assignments/step-2-miscellaneous-pure",
    "https://step.maths.org/assignments/step-2-statistics",
    "https://step.maths.org/assignments/step-2-trigonometry",
    "https://step.maths.org/assignments/step-2-vectors",
    "https://step.maths.org/assignments/step-3-algebra",
    "https://step.maths.org/assignments/step-3-calculus",
    "https://step.maths.org/assignments/step-3-complex-numbers",
    "https://step.maths.org/assignments/step-3-coordinate-geometry-including-polar-coordinates",
    "https://step.maths.org/assignments/step-3-differential-equations",
    "https://step.maths.org/assignments/step-3-hyperbolic-functions",
    "https://step.maths.org/assignments/step-3-matrices",
    "https://step.maths.org/assignments/step-3-mechanics",
    "https://step.maths.org/assignments/step-3-statistics",
    "https://step.maths.org/assignments/step-3-vectors",
    "https://step.maths.org/assignments/step-support-assignment-1",
    "https://step.maths.org/assignments/step-support-assignment-10",
    "https://step.maths.org/assignments/step-support-assignment-11",
    "https://step.maths.org/assignments/step-support-assignment-12",
    "https://step.maths.org/assignments/step-support-assignment-13",
    "https://step.maths.org/assignments/step-support-assignment-14",
    "https://step.maths.org/assignments/step-support-assignment-15",
    "https://step.maths.org/assignments/step-support-assignment-16",
    "https://step.maths.org/assignments/step-support-assignment-17",
    "https://step.maths.org/assignments/step-support-assignment-18",
    "https://step.maths.org/assignments/step-support-assignment-19",
    "https://step.maths.org/assignments/step-support-assignment-2",
    "https://step.maths.org/assignments/step-support-assignment-20",
    "https://step.maths.org/assignments/step-support-assignment-21",
    "https://step.maths.org/assignments/step-support-assignment-22",
    "https://step.maths.org/assignments/step-support-assignment-23",
    "https://step.maths.org/assignments/step-support-assignment-24",
    "https://step.maths.org/assignments/step-support-assignment-25",
    "https://step.maths.org/assignments/step-support-assignment-3",
    "https://step.maths.org/assignments/step-support-assignment-4",
    "https://step.maths.org/assignments/step-support-assignment-5",
    "https://step.maths.org/assignments/step-support-assignment-6",
    "https://step.maths.org/assignments/step-support-assignment-7",
    "https://step.maths.org/assignments/step-support-assignment-8",
    "https://step.maths.org/assignments/step-support-assignment-9",
    "https://step.maths.org/assignments/various-mixed-step-3-pure-questions",
    "https://step.maths.org/how-use-step-support-programme",
    "https://step.maths.org/questions",
    "https://step.maths.org/sites/default/files/2023-06/Feedback_A1_7.pdf",
    "https://step.maths.org/sites/default/files/2023-06/assignment1_0.pdf",
    "https://step.maths.org/sites/default/files/2023-07/Algebra3_hints_1.pdf",
    "https://step.maths.org/sites/default/files/2023-07/Algebra3_questions_1.pdf",
    "https://step.maths.org/sites/default/files/2023-07/Algebra3_solutions_2.pdf",
    "https://step.maths.org/sites/default/files/2023-07/Algebra3_topic_notes_0.pdf",
    "https://step.maths.org/sites/default/files/2023-07/Calc3_hints_0.pdf",
    "https://step.maths.org/sites/default/files/2023-07/Calc3_questions_1.pdf",
    "https://step.maths.org/sites/default/files/2023-07/Calc3_solutions_0.pdf",
    "https://step.maths.org/sites/default/files/2023-07/Calc3_topic_notes_0.pdf",
    "https://step.maths.org/sites/default/files/2023-07/Calc_II_topic_notes_2019_0.pdf",
    "https://step.maths.org/sites/default/files/2023-07/Calc_hints_2019_0.pdf",
    "https://step.maths.org/sites/default/files/2023-07/Calc_questions_2019_0.pdf",
    "https://step.maths.org/sites/default/files/2023-07/Calc_solutions_2019_0.pdf",
    "https://step.maths.org/sites/default/files/2023-07/Complex_3_hints_2019.pdf",
    "https://step.maths.org/sites/default/files/2023-07/Complex_3_questions_2019_0.pdf",
    "https://step.maths.org/sites/default/files/2023-07/Complex_3_solutions_2019.pdf",
    "https://step.maths.org/sites/default/files/2023-07/Complex_3_topic_notes_2019.pdf",
    "https://step.maths.org/sites/default/files/2023-07/Complex_hints_2019_1.pdf",
    "https://step.maths.org/sites/default/files/2023-07/Complex_questions_2019_1.pdf",
    "https://step.maths.org/sites/default/files/2023-07/Complex_solutions_2019_0.pdf",
    "https://step.maths.org/sites/default/files/2023-07/Complex_topic_notes_2019_0.pdf",
    "https://step.maths.org/sites/default/files/2023-07/CoordGeom_Hints_1.pdf",
    "https://step.maths.org/sites/default/files/2023-07/CoordGeom_Solutions_1.pdf",
    "https://step.maths.org/sites/default/files/2023-07/CoordGeom_questions_2.pdf",
    "https://step.maths.org/sites/default/files/2023-07/DE_hints.pdf",
    "https://step.maths.org/sites/default/files/2023-07/DE_questions.pdf",
    "https://step.maths.org/sites/default/files/2023-07/DE_solutions_1.pdf",
    "https://step.maths.org/sites/default/files/2023-07/DE_topic_notes.pdf",
    "https://step.maths.org/sites/default/files/2023-07/Eqns_hints_2019.pdf",